{
  "version": 1,
  "generated_at": "2026-10-27T20:31:11+03:00",
  "origin": "2026-10-26",
  "data_range": {
    "start": "2023-11-01",
    "end": "2026-10-26",
    "recorded_days": 1072,
    "missing_days": 19
  },
  "method": {
    "name": "grouped_regularized_combination",
    "lambda": 1.0,
    "a0": {
      "weekly": 0.8784,
      "monthly": 0.8958
    },
    "group_thresholds": {
      "zero_ratio_intermittent": 0.5,
      "cv_split": [0.3932],
      "min_obs": 56
    },
    "weights": {
      "weekly": {
        "steady": 0.8777,
        "variable": 0.8816,
        "intermittent": 0.8739,
        "sparse": 0.8784
      },
      "monthly": {
        "steady": 0.8954,
        "variable": 0.9012,
        "intermittent": 0.8886,
        "sparse": 0.8958
      }
    },
    "xgboost_params": {
      "eta": 0.1,
      "max_depth": 4,
      "min_child_weight": 1,
      "n_estimators": 80,
      "tree_method": "hist",
      "random_state": 7
    },
    "features": {
      "lags": [1, 7, 14, 28],
      "ma_windows": [7, 28]
    },
    "monthly_mode": "calendar",
    "scale": "product_mean",
    "selection": {
      "plan": {
        "test_start": "2025-11-01",
        "internal_origins": ["2025-06-30", "2025-07-31", "2025-08-31", "2025-09-30"],
        "tune_origins": ["2025-08-31", "2025-09-30"],
        "external_origins": [
          "2025-10-31",
          "2025-11-30",
          "2025-12-31",
          "2026-01-31",
          "2026-02-28",
          "2026-03-31",
          "2026-04-30",
          "2026-05-31",
          "2026-06-30",
          "2026-07-31",
          "2026-08-31"
        ]
      },
      "xgboost_grid": [
        {
          "params": {
            "eta": 0.1,
            "max_depth": 3,
            "min_child_weight": 1,
            "n_estimators": 80
          },
          "wape_pilot": {
            "monthly": 8.3354,
            "weekly": 9.6453
          },
          "score": 17.9807
        },
        {
          "params": {
            "eta": 0.1,
            "max_depth": 4,
            "min_child_weight": 1,
            "n_estimators": 80
          },
          "wape_pilot": {
            "monthly": 7.3199,
            "weekly": 9.4981
          },
          "score": 16.818
        }
      ],
      "threshold_lambda_grid": [
        {
          "zero_ratio_intermittent": 0.5,
          "cv_split": 0.3932,
          "lambda": 0.0,
          "wape_pilot": {
            "monthly": 7.2696,
            "weekly": 10.5744
          },
          "score": 17.8441
        },
        {
          "zero_ratio_intermittent": 0.5,
          "cv_split": 0.3932,
          "lambda": 0.1,
          "wape_pilot": {
            "monthly": 6.5077,
            "weekly": 9.8024
          },
          "score": 16.3101
        },
        {
          "zero_ratio_intermittent": 0.5,
          "cv_split": 0.3932,
          "lambda": 1.0,
          "wape_pilot": {
            "monthly": 6.5426,
            "weekly": 9.7298
          },
          "score": 16.2724
        },
        {
          "zero_ratio_intermittent": 0.5,
          "cv_split": 0.4877,
          "lambda": 0.0,
          "wape_pilot": {
            "monthly": 6.9105,
            "weekly": 10.0509
          },
          "score": 16.9614
        },
        {
          "zero_ratio_intermittent": 0.5,
          "cv_split": 0.4877,
          "lambda": 0.1,
          "wape_pilot": {
            "monthly": 6.554,
            "weekly": 9.7971
          },
          "score": 16.3511
        },
        {
          "zero_ratio_intermittent": 0.5,
          "cv_split": 0.4877,
          "lambda": 1.0,
          "wape_pilot": {
            "monthly": 6.5461,
            "weekly": 9.7295
          },
          "score": 16.2756
        }
      ],
      "criterion": "pilot ürünlerde iç doğrulama WAPE toplamı (monthly, weekly)"
    },
    "fixed_weights": {
      "ablation_common_weight": {
        "lambda": 0.0,
        "a0": {
          "weekly": 1.0,
          "monthly": 0.978
        },
        "weights": {
          "weekly": {
            "steady": 1.0,
            "variable": 1.0,
            "intermittent": 1.0,
            "sparse": 1.0
          },
          "monthly": {
            "steady": 0.978,
            "variable": 0.978,
            "intermittent": 0.978,
            "sparse": 0.978
          }
        },
        "n_obs": {
          "weekly": {
            "steady": 20,
            "variable": 38,
            "intermittent": 20,
            "sparse": 2
          },
          "monthly": {
            "steady": 20,
            "variable": 38,
            "intermittent": 20,
            "sparse": 2
          }
        },
        "fallback_a0": {
          "weekly": {
            "steady": true,
            "variable": true,
            "intermittent": true,
            "sparse": true
          },
          "monthly": {
            "steady": true,
            "variable": true,
            "intermittent": true,
            "sparse": true
          }
        }
      },
      "ablation_group_no_reg": {
        "lambda": 0.0,
        "a0": {
          "weekly": 1.0,
          "monthly": 0.978
        },
        "weights": {
          "weekly": {
            "steady": 0.6024,
            "variable": 1.0,
            "intermittent": 1.0,
            "sparse": 1.0
          },
          "monthly": {
            "steady": 0.5591,
            "variable": 0.916,
            "intermittent": 0.9907,
            "sparse": 0.978
          }
        },
        "n_obs": {
          "weekly": {
            "steady": 20,
            "variable": 38,
            "intermittent": 20,
            "sparse": 2
          },
          "monthly": {
            "steady": 20,
            "variable": 38,
            "intermittent": 20,
            "sparse": 2
          }
        },
        "fallback_a0": {
          "weekly": {
            "steady": false,
            "variable": false,
            "intermittent": false,
            "sparse": true
          },
          "monthly": {
            "steady": false,
            "variable": false,
            "intermittent": false,
            "sparse": true
          }
        }
      },
      "ablation_group_reg_fixed": {
        "lambda": 1.0,
        "a0": {
          "weekly": 1.0,
          "monthly": 0.978
        },
        "weights": {
          "weekly": {
            "steady": 0.9981,
            "variable": 1.0,
            "intermittent": 1.0,
            "sparse": 1.0
          },
          "monthly": {
            "steady": 0.9758,
            "variable": 0.976,
            "intermittent": 0.9821,
            "sparse": 0.978
          }
        },
        "n_obs": {
          "weekly": {
            "steady": 20,
            "variable": 38,
            "intermittent": 20,
            "sparse": 2
          },
          "monthly": {
            "steady": 20,
            "variable": 38,
            "intermittent": 20,
            "sparse": 2
          }
        },
        "fallback_a0": {
          "weekly": {
            "steady": false,
            "variable": false,
            "intermittent": false,
            "sparse": true
          },
          "monthly": {
            "steady": false,
            "variable": false,
            "intermittent": false,
            "sparse": true
          }
        }
      }
    }
  },
  "horizons": {
    "weekly": {
      "days": 7,
      "start": "2026-10-27",
      "end": "2026-11-02"
    },
    "monthly": {
      "days": 30,
      "start": "2026-11-01",
      "end": "2026-11-30"
    }
  },
  "products": [
    {
      "barcode": "0000086931676",
      "name": "Kola 2,5 L",
      "category": "İçecek",
      "unit": "adet",
      "group": "variable",
      "history": {
        "observations": 1072,
        "last_sale": "2026-10-26",
        "mean_daily_90d": 7.787
      },
      "forecast": {
        "weekly": {
          "combined": 53.231,
          "xgboost": 52.725,
          "seasonal_naive": 57.0,
          "weight": 0.8816,
          "daily": [5.904, 7.047, 4.508, 9.294, 10.816, 9.889, 5.774]
        },
        "monthly": {
          "combined": 222.627,
          "xgboost": 220.175,
          "seasonal_naive": 245.0,
          "weight": 0.9012
        }
      },
      "backtest": {
        "weekly": {
          "mae": {
            "combined": 8.298,
            "xgboost": 8.279,
            "seasonal_naive": 9.818
          },
          "wape": {
            "combined": 15.657,
            "xgboost": 15.621,
            "seasonal_naive": 18.525
          },
          "n_origins": 11
        },
        "monthly": {
          "mae": {
            "combined": 7.735,
            "xgboost": 8.036,
            "seasonal_naive": 21.273
          },
          "wape": {
            "combined": 3.438,
            "xgboost": 3.572,
            "seasonal_naive": 9.455
          },
          "n_origins": 11
        }
      },
      "stock": {
        "lead_time_days": 2,
        "review_days": 7,
        "demand_over_lead_and_review": 64.176,
        "safety_stock": 13.513,
        "order_up_to": 78.0,
        "pack_size": 1.0,
        "service_level": 0.9,
        "on_hand": null,
        "suggested_order": null
      },
      "flags": []
    },
    {
      "barcode": "0000087002947",
      "name": "Çikolata & Gofret",
      "category": "Atıştırmalık",
      "unit": "adet",
      "group": "variable",
      "history": {
        "observations": 1072,
        "last_sale": "2026-10-26",
        "mean_daily_90d": 11.921
      },
      "forecast": {
        "weekly": {
          "combined": 63.792,
          "xgboost": 62.69,
          "seasonal_naive": 72.0,
          "weight": 0.8816,
          "daily": [9.875, 10.146, 7.369, 10.14, 8.933, 8.556, 8.773]
        },
        "monthly": {
          "combined": 269.68,
          "xgboost": 265.918,
          "seasonal_naive": 304.0,
          "weight": 0.9012
        }
      },
      "backtest": {
        "weekly": {
          "mae": {